{
  "schema_version": "regulation-rule-draft-v1",
  "regulation_id": "reg_3454a11dabae",
  "regulation_title": "eCTD实施指南",
  "source_version": "unknown",
  "draft_rule_count": 8,
  "category_counts": {
    "hard": 2,
    "soft": 6
  },
  "rules": [
    {
      "rule_id": "DRAFT-SR-reg_3454a11dabae-004",
      "status": "draft",
      "implementation_state": "planned",
      "category": "soft",
      "title": "2.1 申请人及监管机构的责任",
      "regulation_id": "reg_3454a11dabae",
      "clause_id": "reg_3454a11dabae:sec_2_1",
      "article_no": 4,
      "material_checkability": "direct",
      "ind_relevance": "high",
      "expected_material_evidence": [
        "general_registration_dossier"
      ],
      "candidate_reason": "Direct dossier-facing requirement or evidence-bearing registration condition.",
      "citation": {
        "anchor": "reg_3454a11dabae#sec_2_1",
        "source_path": "D:\\AutoIND-Pro\\ind-compliance-ai\\data\\regulations\\eCTD实施指南.pdf",
        "source_regulation": "reg_3454a11dabae",
        "source_version": "unknown"
      },
      "implementation_notes": "Promoted from direct dossier-checkable regulation clause. Still needs explicit evaluator logic over material_review_contract evidence."
    },
    {
      "rule_id": "DRAFT-HR-reg_3454a11dabae-005",
      "status": "draft",
      "implementation_state": "planned",
      "category": "hard",
      "title": "2.2 从纸质递交向eCTD 电子提交过渡的考虑",
      "regulation_id": "reg_3454a11dabae",
      "clause_id": "reg_3454a11dabae:sec_2_2",
      "article_no": 5,
      "material_checkability": "direct",
      "ind_relevance": "high",
      "expected_material_evidence": [
        "general_registration_dossier",
        "clinical_trial_materials"
      ],
      "candidate_reason": "Direct dossier-facing requirement or evidence-bearing registration condition.",
      "citation": {
        "anchor": "reg_3454a11dabae#sec_2_2",
        "source_path": "D:\\AutoIND-Pro\\ind-compliance-ai\\data\\regulations\\eCTD实施指南.pdf",
        "source_regulation": "reg_3454a11dabae",
        "source_version": "unknown"
      },
      "implementation_notes": "Promoted from direct dossier-checkable regulation clause. Still needs explicit evaluator logic over material_review_contract evidence."
    },
    {
      "rule_id": "DRAFT-HR-reg_3454a11dabae-006",
      "status": "draft",
      "implementation_state": "planned",
      "category": "hard",
      "title": "2.3 存储介质的选择及刻录光盘的要求",
      "regulation_id": "reg_3454a11dabae",
      "clause_id": "reg_3454a11dabae:sec_2_3",
      "article_no": 6,
      "material_checkability": "direct",
      "ind_relevance": "high",
      "expected_material_evidence": [
        "general_registration_dossier"
      ],
      "candidate_reason": "Direct dossier-facing requirement or evidence-bearing registration condition.",
      "citation": {
        "anchor": "reg_3454a11dabae#sec_2_3",
        "source_path": "D:\\AutoIND-Pro\\ind-compliance-ai\\data\\regulations\\eCTD实施指南.pdf",
        "source_regulation": "reg_3454a11dabae",
        "source_version": "unknown"
      },
      "implementation_notes": "Promoted from direct dossier-checkable regulation clause. Still needs explicit evaluator logic over material_review_contract evidence."
    },
    {
      "rule_id": "DRAFT-SR-reg_3454a11dabae-007",
      "status": "draft",
      "implementation_state": "planned",
      "category": "soft",
      "title": "2.4 光盘封面信息",
      "regulation_id": "reg_3454a11dabae",
      "clause_id": "reg_3454a11dabae:sec_2_4",
      "article_no": 7,
      "material_checkability": "direct",
      "ind_relevance": "high",
      "expected_material_evidence": [
        "general_registration_dossier"
      ],
      "candidate_reason": "Direct dossier-facing requirement or evidence-bearing registration condition.",
      "citation": {
        "anchor": "reg_3454a11dabae#sec_2_4",
        "source_path": "D:\\AutoIND-Pro\\ind-compliance-ai\\data\\regulations\\eCTD实施指南.pdf",
        "source_regulation": "reg_3454a11dabae",
        "source_version": "unknown"
      },
      "implementation_notes": "Promoted from direct dossier-checkable regulation clause. Still needs explicit evaluator logic over material_review_contract evidence."
    },
    {
      "rule_id": "DRAFT-SR-reg_3454a11dabae-008",
      "status": "draft",
      "implementation_state": "planned",
      "category": "soft",
      "title": "2.5 病毒检查",
      "regulation_id": "reg_3454a11dabae",
      "clause_id": "reg_3454a11dabae:sec_2_5",
      "article_no": 8,
      "material_checkability": "direct",
      "ind_relevance": "high",
      "expected_material_evidence": [
        "general_registration_dossier"
      ],
      "candidate_reason": "Direct dossier-facing requirement or evidence-bearing registration condition.",
      "citation": {
        "anchor": "reg_3454a11dabae#sec_2_5",
        "source_path": "D:\\AutoIND-Pro\\ind-compliance-ai\\data\\regulations\\eCTD实施指南.pdf",
        "source_regulation": "reg_3454a11dabae",
        "source_version": "unknown"
      },
      "implementation_notes": "Promoted from direct dossier-checkable regulation clause. Still needs explicit evaluator logic over material_review_contract evidence."
    },
    {
      "rule_id": "DRAFT-SR-reg_3454a11dabae-009",
      "status": "draft",
      "implementation_state": "planned",
      "category": "soft",
      "title": "2.6 技术验证",
      "regulation_id": "reg_3454a11dabae",
      "clause_id": "reg_3454a11dabae:sec_2_6",
      "article_no": 9,
      "material_checkability": "direct",
      "ind_relevance": "high",
      "expected_material_evidence": [
        "general_registration_dossier"
      ],
      "candidate_reason": "Direct dossier-facing requirement or evidence-bearing registration condition.",
      "citation": {
        "anchor": "reg_3454a11dabae#sec_2_6",
        "source_path": "D:\\AutoIND-Pro\\ind-compliance-ai\\data\\regulations\\eCTD实施指南.pdf",
        "source_regulation": "reg_3454a11dabae",
        "source_version": "unknown"
      },
      "implementation_notes": "Promoted from direct dossier-checkable regulation clause. Still needs explicit evaluator logic over material_review_contract evidence."
    },
    {
      "rule_id": "DRAFT-SR-reg_3454a11dabae-010",
      "status": "draft",
      "implementation_state": "planned",
      "category": "soft",
      "title": "2.7 提交要求",
      "regulation_id": "reg_3454a11dabae",
      "clause_id": "reg_3454a11dabae:sec_2_7",
      "article_no": 10,
      "material_checkability": "direct",
      "ind_relevance": "high",
      "expected_material_evidence": [
        "general_registration_dossier"
      ],
      "candidate_reason": "Direct dossier-facing requirement or evidence-bearing registration condition.",
      "citation": {
        "anchor": "reg_3454a11dabae#sec_2_7",
        "source_path": "D:\\AutoIND-Pro\\ind-compliance-ai\\data\\regulations\\eCTD实施指南.pdf",
        "source_regulation": "reg_3454a11dabae",
        "source_version": "unknown"
      },
      "implementation_notes": "Promoted from direct dossier-checkable regulation clause. Still needs explicit evaluator logic over material_review_contract evidence."
    },
    {
      "rule_id": "DRAFT-SR-reg_3454a11dabae-011",
      "status": "draft",
      "implementation_state": "planned",
      "category": "soft",
      "title": "2.8 纸质资料的递交及要求",
      "regulation_id": "reg_3454a11dabae",
      "clause_id": "reg_3454a11dabae:sec_2_8",
      "article_no": 11,
      "material_checkability": "direct",
      "ind_relevance": "high",
      "expected_material_evidence": [
        "general_registration_dossier"
      ],
      "candidate_reason": "Direct dossier-facing requirement or evidence-bearing registration condition.",
      "citation": {
        "anchor": "reg_3454a11dabae#sec_2_8",
        "source_path": "D:\\AutoIND-Pro\\ind-compliance-ai\\data\\regulations\\eCTD实施指南.pdf",
        "source_regulation": "reg_3454a11dabae",
        "source_version": "unknown"
      },
      "implementation_notes": "Promoted from direct dossier-checkable regulation clause. Still needs explicit evaluator logic over material_review_contract evidence."
    }
  ]
}